{
  "$schema": "https://json-schema.org/draft/2020-12/schema",
  "title": "liveops.event.v1 data",
  "description": "Payload of a liveops.event.v1 Resource (yes2games/yes2sdk-core#42 section 8). The reference validator also enforces real calendar dates, startAt before endAt as instants, the config.v1 validator rules on payload, at most 131072 bytes in total and, inside a runtime snapshot, that every artifactRef is a snapshot Artifact digest. See contracts/README.md.",
  "type": "object",
  "required": ["startAt", "endAt", "payload", "artifactRefs"],
  "additionalProperties": false,
  "properties": {
    "startAt": { "$ref": "#/$defs/timestamp" },
    "endAt": { "$ref": "#/$defs/timestamp" },
    "payload": { "$ref": "config-v1.schema.json" },
    "artifactRefs": {
      "type": "array",
      "maxItems": 64,
      "uniqueItems": true,
      "items": { "type": "string", "pattern": "^sha256:[0-9a-f]{64}$" }
    }
  },
  "$defs": {
    "timestamp": {
      "type": "string",
      "pattern": "^(?!0000)[0-9]{4}-(?:0[1-9]|1[0-2])-(?:0[1-9]|[12][0-9]|3[01])T(?:[01][0-9]|2[0-3]):[0-5][0-9]:[0-5][0-9](?:\\.[0-9]{1,3})?Z$"
    }
  }
}
