{"startAt":"2026-12-01T00:00:00Z","endAt":"2026-12-08T00:00:00Z","payload":{},"artifactRefs":["sha256:5feceb66ffc86f38d952786c6d696c79c2dbc239dd4e91b46729d73a27fb57e9","sha256:6b86b273ff34fce19d6b804eff5a3f5747ada4eaa22f1d49c01e52ddb7875b4b","sha256:d4735e3a265e16eee03f59718b9b5d03019c07d8b6c51f90da3a666eec13ab35","sha256:4e07408562bedb8b60ce05c1decfe3ad16b72230967de01f640b7e4729b49fce","sha256:4b227777d4dd1fc61c6f884f48641d02b4d121d3fd328cb08b5531fcacdabf8a","sha256:ef2d127de37b942baad06145e54b0c619a1f22327b2ebbcfbec78f5564afe39d","sha256:e7f6c011776e8db7cd330b54174fd76f7d0216b612387a5ffcfb81e6f0919683","sha256:7902699be42c8a8e46fbbb4501726517e86b22c56a189f7625a6da49081b2451","sha256:2c624232cdd221771294dfbb310aca000a0df6ac8b66b696d90ef06fdefb64a3","sha256:19581e27de7ced00ff1ce50b2047e7a567c76b1cbaebabe5ef03f7c3017bb5b7","sha256:4a44dc15364204a80fe80e9039455cc1608281820fe2b24f1e5233ade6af1dd5","sha256:4fc82b26aecb47d2868c4efbe3581732a3e7cbcc6c2efb32062c08170a05eeb8","sha256:6b51d431df5d7f141cbececcf79edf3dd861c3b4069f0b11661a3eefacbba918","sha256:3fdba35f04dc8c462986c992bcf875546257113072a909c162f7e470e581e278","sha256:8527a891e224136950ff32ca212b45bc93f69fbb801c3b1ebedac52775f99e61","sha256:e629fa6598d732768f7c726b4b621285f9c3b85303900aa912017db7617d8bdb","sha256:b17ef6d19c7a5b1ee83b907c595526dcb1eb06db8227d650d5dda0a9f4ce8cd9","sha256:4523540f1504cd17100c4835e85b7eefd49911580f8efff0599a8f283be6b9e3","sha256:4ec9599fc203d176a301536c2e091a19bc852759b255bd6818810a42c5fed14a","sha256:9400f1b21cb527d7fa3d3eabba93557a18ebe7a2ca4e471cfe5e4c5b4ca7f767","sha256:f5ca38f748a1d6eaf726b8a42fb575c3c71f1864a8143301782de13da2d9202b","sha256:6f4b6612125fb3a0daecd2799dfd6c9c299424fd920f9b308110a2c1fbd8f443","sha256:785f3ec7eb32f30b90cd0fcf3657d388b5ff4297f2f9716ff66e9b69c05ddd09","sha256:535fa30d7e25dd8a49f1536779734ec8286108d115da5045d77f3b4185d8f790","sha256:c2356069e9d1e79ca924378153cfbbfb4d4416b1f99d41a2940bfdb66c5319db","sha256:b7a56873cd771f2c446d369b649430b65a756ba278ff97ec81bb6f55b2e73569","sha256:5f9c4ab08cac7457e9111a30e4664920607ea2c115a1433d7be98e97e64244ca","sha256:670671cd97404156226e507973f2ab8330d3022ca96e0c93bdbdb320c41adcaf","sha256:59e19706d51d39f66711c2653cd7eb1291c94d9b55eb14bda74ce4dc636d015a","sha256:35135aaa6cc23891b40cb3f378c53a17a1127210ce60e125ccf03efcfdaec458","sha256:624b60c58c9d8bfb6ff1886c2fd605d2adeb6ea4da576068201b6c6958ce93f4","sha256:eb1e33e8a81b697b75855af6bfcdbcbf7cbbde9f94962ceaec1ed8af21f5a50f","sha256:e29c9c180c6279b0b02abd6a1801c7c04082cf486ec027aa13515e4f3884bb6b","sha256:c6f3ac57944a531490cd39902d0f777715fd005efac9a30622d5f5205e7f6894","sha256:86e50149658661312a9e0b35558d84f6c6d3da797f552a9657fe0558ca40cdef","sha256:9f14025af0065b30e47e23ebb3b491d39ae8ed17d33739e5ff3827ffb3634953","sha256:76a50887d8f1c2e9301755428990ad81479ee21c25b43215cf524541e0503269","sha256:7a61b53701befdae0eeeffaecc73f14e20b537bb0f8b91ad7c2936dc63562b25","sha256:aea92132c4cbeb263e6ac2bf6c183b5d81737f179f21efdc5863739672f0f470","sha256:0b918943df0962bc7a1824c0555a389347b4febdc7cf9d1254406d80ce44e3f9","sha256:d59eced1ded07f84c145592f65bdf854358e009c5cd705f5215bf18697fed103","sha256:3d914f9348c9cc0ff8a79716700b9fcd4d2f3e711608004eb8f138bcba7f14d9","sha256:73475cb40a568e8da8a045ced110137e159f890ac4da883b6b17dc651b3a8049","sha256:44cb730c420480a0477b505ae68af508fb90f96cf0ec54c6ad16949dd427f13a","sha256:71ee45a3c0db9a9865f7313dd3372cf60dca6479d46261f3542eb9346e4a04d6","sha256:811786ad1ae74adfdd20dd0372abaaebc6246e343aebd01da0bfc4c02bf0106c","sha256:25fc0e7096fc653718202dc30b0c580b8ab87eac11a700cba03a7c021bc35b0c","sha256:31489056e0916d59fe3add79e63f095af3ffb81604691f21cad442a85c7be617","sha256:98010bd9270f9b100b6214a21754fd33bdc8d41b2bc9f9dd16ff54d3c34ffd71","sha256:0e17daca5f3e175f448bacace3bc0da47d0655a74c8dd0dc497a3afbdad95f1f","sha256:1a6562590ef19d1045d06c4055742d38288e9e6dcd71ccde5cee80f1d5a774eb","sha256:031b4af5197ec30a926f48cf40e11a7dbc470048a21e4003b7a3c07c5dab1baa","sha256:41cfc0d1f2d127b04555b7246d84019b4d27710a3f3aff6e7764375b1e06e05d","sha256:2858dcd1057d3eae7f7d5f782167e24b61153c01551450a628cee722509f6529","sha256:2fca346db656187102ce806ac732e06a62df0dbb2829e511a770556d398e1a6e","sha256:02d20bbd7e394ad5999a4cebabac9619732c343a4cac99470c03e23ba2bdc2bc","sha256:7688b6ef52555962d008fff894223582c484517cea7da49ee67800adc7fc8866","sha256:c837649cce43f2729138e72cc315207057ac82599a59be72765a477f22d14a54","sha256:6208ef0f7750c111548cf90b6ea1d0d0a66f6bff40dbef07cb45ec436263c7d6","sha256:3e1e967e9b793e908f8eae83c74dba9bcccce6a5535b4b462bd9994537bfe15c","sha256:39fa9ec190eee7b6f4dff1100d6343e10918d044c75eac8f9e9a2596173f80c9","sha256:d029fa3a95e174a19934857f535eb9427d967218a36ea014b70ad704bc6c8d1c","sha256:81b8a03f97e8787c53fe1a86bda042b6f0de9b0ec9c09357e107c99ba4d6948a","sha256:da4ea2a5506f2693eae190d9360a1f31793c98a1adade51d93533a6f520ace1c"]}
