{"startAt":"2026-12-01T00:00:00Z","endAt":"2026-12-08T00:00:00Z","payload":{"theme":"winter","multiplier":1.5,"tiers":[1,2,3],"flags":{"banner":true}},"artifactRefs":["sha256:08ab2df7b162c2f60b44f4effd756212164f3f106dc2b3bf0f4fe910907d8744","sha256:b0940a72356dfccd36a77a007ad31ef4709155d5bfa4aef325f229b1700dca2e"]}
